{
  "verdict_id": "VD-2026-07-08-0004",
  "control_id": "SA-IOT-002",
  "device_id": "device-hardened",
  "status": "PASS",
  "severity": "high",
  "evidence_ids": [
    "EV-2026-07-08-0016"
  ],
  "matched": "pass",
  "reason": "observations.default_creds equals False",
  "saudi_source": "CGIoT-1:2024 \u00a72-2-2",
  "remediation": "Force a unique strong password on first boot; remove all vendor defaults.",
  "timestamp": "2026-07-08T08:58:44Z"
}