{
  "verdict_id": "VD-2026-07-08-0002",
  "control_id": "SA-IOT-003",
  "device_id": "device-insecure",
  "status": "FAIL",
  "severity": "high",
  "evidence_ids": [
    "EV-2026-07-08-0014"
  ],
  "matched": "fail",
  "reason": "observations.telnet_open equals True",
  "saudi_source": "CGIoT-1:2024 \u00a72-15-2",
  "remediation": "Remove Telnet and any other non-essential listening service from the device image.",
  "timestamp": "2026-07-08T08:58:43Z"
}